<?xml version="1.0" encoding="utf-8"?>
<Template
  xmlns:xsi="http://www.w3.org/2001/XMLSchema-instance"
  xsi:noNamespaceSchemaLocation="..\Schemas\DocumentSchema.xsd">
  <Fonts>
    <Font ID="Small">
      <Name>Arial</Name>
      <Size>12</Size>
    </Font>
    <Font ID="Usual">
      <Name>Arial</Name>
      <Size>12</Size>
    </Font>
    <Font ID="16">
      <Name>Arial</Name>
      <Size>16</Size>
    </Font>
    <Font ID="24">
      <Name>Arial</Name>
      <Size>24</Size>
    </Font>
    <Font ID="Large">
      <Name>Arial</Name>
      <Size>32</Size>
    </Font>
    <Font ID="LargeBold">
      <Name>Arial</Name>
      <Size>32</Size>
      <Style>Bold</Style>
    </Font>
  </Fonts>
  <Document>
    <Word>
      <Properties>
        <A5/>
        <Album/>
        <Margins>
          <Left>35</Left>
          <Top>35</Top>
        </Margins>
      </Properties>
      <Structure>
        <Element>
          <FixedTable>
            <ColumnsParameters>
              <Columns>
                <ColumnWidth>550</ColumnWidth>
                <ColumnWidth>9700</ColumnWidth>
              </Columns>
            </ColumnsParameters>
            <Borders>
              <Left>
                <Style>None</Style>
              </Left>
              <Top>
                <Style>None</Style>
              </Top>
              <Right>
                <Style>None</Style>
              </Right>
              <Bottom>
                <Style>None</Style>
              </Bottom>
            </Borders>
            <Rows>
              <Row>
                <Cells>
                  <Cell Column="0">
                    <Borders>
                      <Right>
                        <Style>Dashed</Style>
                      </Right>
                      <Bottom>
                        <Style>None</Style>
                      </Bottom>
                    </Borders>
                    <Paragraphs>
                      <Paragraph>
                        <FontID>16</FontID>
                        <Parts>
                          <Part>
                            <Text>
                              <String>Иванов</String>
                            </Text>
                          </Part>
                          <Part>
                            <Text>
                              <String>--</String>
                            </Text>
                          </Part>
                          <Part>
                            <Text>
                              <String>И.И.</String>
                            </Text>
                          </Part>
                        </Parts>
                      </Paragraph>
                    </Paragraphs>
                  </Cell>
                  <Cell Column="1">
                    <Borders>
                      <Left>
                        <Style>Dashed</Style>
                      </Left>
                      <Bottom>
                        <Style>None</Style>
                      </Bottom>
                    </Borders>
                    <Paragraphs>
                      <Paragraph>
                        <FontID>Large</FontID>
                        <Alighment>Right</Alighment>
                        <Parts>
                          <Part>
                            <Text>
                              <String>№</String>
                            </Text>
                          </Part>
                          <Part>
                            <Text>
                              <String>5</String>
                            </Text>
                          </Part>
                          <Part>
                            <Text>
                              <String> |</String>
                            </Text>
                          </Part>
                          <Part>
                            <Text>
                              <String>АБР</String>
                            </Text>
                          </Part>
                          <Part>
                            <Text>
                              <String>|</String>
                            </Text>
                          </Part>
                        </Parts>
                      </Paragraph>
                      <Paragraph/>
                      <Paragraph>
                        <FontID>Usual</FontID>
                        <Alighment>Right</Alighment>
                        <Parts>
                          <Part>
                            <Text>
                              <String>Направление подготовки </String>
                            </Text>
                          </Part>
                          <Part>
                            <Text>
                              <String>НАПРАВЛЕНИЕ</String>
                            </Text>
                          </Part>
                        </Parts>
                      </Paragraph>
                      <Paragraph>
                        <FontID>Usual</FontID>
                        <Alighment>Right</Alighment>
                        <Parts>
                          <Part>
                            <Text>
                              <String>Магистрская программа </String>
                            </Text>
                          </Part>
                          <Part>
                            <Text>
                              <String>ПРОГРАММА</String>
                            </Text>
                          </Part>
                        </Parts>
                      </Paragraph>
                      <Paragraph>
                        <FontID>Usual</FontID>
                        <Alighment>Right</Alighment>
                        <Parts>
                          <Part>
                            <Text>
                              <String>Форма обучения </String>
                            </Text>
                          </Part>
                          <Part>
                            <Text>
                              <String>ОчнаЯ</String>
                            </Text>
                          </Part>
                          <Part>
                            <Text>
                              <String> </String>
                            </Text>
                          </Part>
                          <Part>
                            <Text>
                              <String>БюджеТ</String>
                            </Text>
                          </Part>
                        </Parts>
                      </Paragraph>
                      <Paragraph/>
                      <Paragraph>
                        <FontID>LargeBold</FontID>
                        <Alighment>Center</Alighment>
                        <Parts>
                          <Part>
                            <FontID>LargeBold</FontID>
                            <Text>
                              <String>Иванов</String>
                            </Text>
                          </Part>
                        </Parts>
                      </Paragraph>
                      <Paragraph>
                        <FontID>Large</FontID>
                        <Alighment>Center</Alighment>
                        <Parts>
                          <Part>
                            <Text>
                              <String>Иван Иванович</String>
                            </Text>
                          </Part>
                        </Parts>
                      </Paragraph>
                      <Paragraph/>
                      <Paragraph/>
                    </Paragraphs>
                  </Cell>
                </Cells>
              </Row>
              <Row>
                <Cells>
                  <Cell Column="0">
                    <Borders>
                      <Right>
                        <Style>Dashed</Style>
                      </Right>
                      <Top>
                        <Style>None</Style>
                      </Top>
                    </Borders>
                    <Paragraphs>
                      <Paragraph>
                        <FontID>24</FontID>
                        <Parts>
                          <Part>
                            <Text>
                              <String>М</String>
                            </Text>
                          </Part>
                        </Parts>
                      </Paragraph>
                    </Paragraphs>
                  </Cell>
                  <Cell Column="1">
                    <Borders>
                      <Left>
                        <Style>Dashed</Style>
                      </Left>
                      <Top>
                        <Style>None</Style>
                      </Top>
                    </Borders>
                    <Paragraphs>
                      <Paragraph>
                        <FontID>Small</FontID>
                        <Alighment>Center</Alighment>
                        <Parts>
                          <Part>
                            <Text>
                              <String>магистратура</String>
                            </Text>
                          </Part>
                        </Parts>
                      </Paragraph>
                      <Paragraph>
                        <FontID>Large</FontID>
                        <Alighment>Center</Alighment>
                        <Parts>
                          <Part>
                            <Text>
                              <String>2017</String>
                            </Text>
                          </Part>
                        </Parts>
                      </Paragraph>
                    </Paragraphs>
                  </Cell>
                </Cells>
              </Row>
            </Rows>
          </FixedTable>
        </Element>
      </Structure>
    </Word>
  </Document>
</Template>
