<?xml version="1.0" encoding="utf-8"?>
<Template
  xmlns:xsi="http://www.w3.org/2001/XMLSchema-instance"
  xsi:noNamespaceSchemaLocation="..\Schemas\DocumentSchema.xsd">
  <Fonts>
    <Font ID="Usual">
      <Name>Arial</Name>
      <Size>16</Size>
    </Font>
    <Font ID="UsualBold">
      <Name>Arial</Name>
      <Size>16</Size>
      <Style>Bold</Style>
    </Font>
    <Font ID="18">
      <Name>Arial</Name>
      <Size>16</Size>
    </Font>
    <Font ID="20Bold">
      <Name>Arial</Name>
      <Size>20</Size>
      <Style>Bold</Style>
    </Font>
    <Font ID="LargeBold">
      <Name>Arial</Name>
      <Size>22</Size>
      <Style>Bold</Style>
    </Font>
    <Font ID="LargeItalic">
      <Name>Arial</Name>
      <Size>22</Size>
      <Style>Italic</Style>
    </Font>
  </Fonts>
  <Document>
    <Word>
      <Structure>
        <Element>
          <Paragraph>
            <Alighment>Center</Alighment>
            <FontID>18</FontID>
            <Parts>
              <Part>
                <Text>
                  <String>MОСКОВСКИЙ АВТОМОБИЛЬНО-ДОРОЖНЫЙ ГОСУДАРСТВЕННЫЙ ТЕХНИЧЕСКИЙ УНИВЕРСИТЕТ (МАДИ)</String>
                </Text>
              </Part>
            </Parts>
          </Paragraph>
        </Element>
        <Element>
          <Paragraph/>
        </Element>
        <Element>
          <Paragraph>
            <Alighment>Center</Alighment>
            <FontID>20Bold</FontID>
            <Parts>
              <Part>
                <Text>
                  <String>ОПИСЬ</String>
                </Text>
              </Part>
            </Parts>
          </Paragraph>
        </Element>
        <Element>
          <Paragraph>
            <Alighment>Center</Alighment>
            <FontID>Usual</FontID>
            <Parts>
              <Part>
                <Text>
                  <String>документов личного дела №</String>
                </Text>
              </Part>
              <Part>
                <FontID>UsualBold</FontID>
                <Text>
                  <Placeholder>0</Placeholder>
                </Text>
              </Part>
            </Parts>
          </Paragraph>
        </Element>
        <Element>
          <Table>
            <Borders>
              <Left>
                <Style>None</Style>
              </Left>
              <Top>
                <Style>None</Style>
              </Top>
              <Right>
                <Style>None</Style>
              </Right>
              <Bottom>
                <Style>None</Style>
              </Bottom>
              <InsideH>
                <Style>None</Style>
              </InsideH>
              <InsideV>
                <Style>None</Style>
              </InsideV>
            </Borders>
            <Numeration>false</Numeration>
            <Placeholder>0</Placeholder>
            <Structure>
              <Column>
                <Caption/>
                <DataFontID>Usual</DataFontID>
              </Column>
            </Structure>
          </Table>
        </Element>
        <Element>
          <Paragraph/>
        </Element>
        <Element>
          <Paragraph/>
        </Element>
        <Element>
          <Paragraph/>
        </Element>
        <Element>
          <Paragraph/>
        </Element>
        <Element>
          <Paragraph/>
        </Element>
        <Element>
          <Paragraph/>
        </Element>
        <Element>
          <Paragraph>
            <Alighment>Center</Alighment>
            <FontID>LargeBold</FontID>
            <Parts>
              <Part>
                <Text>
                  <Placeholder>1</Placeholder>
                </Text>
              </Part>
            </Parts>
          </Paragraph>
        </Element>
        <Element>
          <Paragraph>
            <Alighment>Center</Alighment>
            <FontID>LargeItalic</FontID>
            <Parts>
              <Part>
                <Text>
                  <Placeholder>2</Placeholder>
                </Text>
              </Part>
            </Parts>
          </Paragraph>
        </Element>
        <Element>
          <Table>
            <Borders>
              <Left>
                <Style>None</Style>
              </Left>
              <Top>
                <Style>None</Style>
              </Top>
              <Right>
                <Style>None</Style>
              </Right>
              <Bottom>
                <Style>None</Style>
              </Bottom>
              <InsideH>
                <Style>None</Style>
              </InsideH>
              <InsideV>
                <Style>None</Style>
              </InsideV>
            </Borders>
            <Numeration>true</Numeration>
            <Placeholder>1</Placeholder>
            <Structure>
              <Column>
                <Caption/>
                <DataFontID>UsualBold</DataFontID>
              </Column>
              <Column>
                <Caption/>
                <DataFontID>Usual</DataFontID>
              </Column>
            </Structure>
          </Table>
        </Element>
        <Element>
          <Paragraph/>
        </Element>
        <Element>
          <Paragraph/>
        </Element>
        <Element>
          <Paragraph>
            <FontID>Usual</FontID>
            <Parts>
              <Part>
                <Text>
                  <String>Принял: </String>
                </Text>
              </Part>
              <Part>
                <Text>
                  <Placeholder>3</Placeholder>
                </Text>
              </Part>
              <Part>
                <Text>
                  <String>                   Компьютер: </String>
                </Text>
              </Part>
              <Part>
                <Text>
                  <Placeholder>4</Placeholder>
                </Text>
              </Part>
            </Parts>
          </Paragraph>
        </Element>
        <Element>
          <Paragraph/>
        </Element>
        <Element>
          <Paragraph>
            <FontID>Usual</FontID>
            <Parts>
              <Part>
                <Text>
                  <String>Дата и время: </String>
                </Text>
              </Part>
              <Part>
                <Text>
                  <Placeholder>5</Placeholder>
                </Text>
              </Part>
            </Parts>
          </Paragraph>
        </Element>
      </Structure>
    </Word>
  </Document>
</Template>
